{
  "schema_version": "urdia.profile-routing-evaluation/v5",
  "corpus_id": "urdia-profile-routing-v5",
  "language": "en",
  "model": {
    "provider": "typesafe",
    "model": "jev-1.13.0",
    "version_pinned": true
  },
  "candidate_id_scope": "case_local",
  "privacy": {
    "persist_raw_response": false,
    "persist_api_key": false,
    "fixture_contains_real_secrets": false
  },
  "cases": [
    {
      "id": "five_number_calculator",
      "split": "development",
      "input": {
        "objective": "Recommend one profile to implement a Python calculator that adds exactly five numbers and tests it.",
        "state": {
          "schema": "urdia-profile-evaluation-state-v1",
          "synthetic_fixture": true,
          "policy": {
            "revision_floor": 7,
            "pinned_profile": null,
            "default_profile": null,
            "automatic_execution": false
          },
          "profiles": {
            "c_d18ff8": {
              "declared_model": "Fixture profile A",
              "executable_available": true,
              "authentication_confirmed": true,
              "launch_digest": "aaaaaaaaaaaaaaaaaaaaaaaaaaaaaaaaaaaaaaaaaaaaaaaaaaaaaaaaaaaaaaaa",
              "evidence_launch_digest": "aaaaaaaaaaaaaaaaaaaaaaaaaaaaaaaaaaaaaaaaaaaaaaaaaaaaaaaaaaaaaaaa",
              "evidence_revision": 7,
              "requested_controls": {
                "model": "fixture-0(api)",
                "effort": "medium"
              },
              "evidence_controls": {
                "model": "fixture-0(api)",
                "effort": "medium"
              },
              "advertised_models": [
                "fixture-0(api)"
              ],
              "advertised_efforts": [
                "none",
                "medium"
              ],
              "task_evidence": [
                "five-number Python calculator with unit tests"
              ],
              "measured_latency_ms": null,
              "measured_cost_microunits": null
            },
            "c_bbdb5e": {
              "declared_model": "Fixture profile B",
              "executable_available": true,
              "authentication_confirmed": true,
              "launch_digest": "bbbbbbbbbbbbbbbbbbbbbbbbbbbbbbbbbbbbbbbbbbbbbbbbbbbbbbbbbbbbbbbb",
              "evidence_launch_digest": "bbbbbbbbbbbbbbbbbbbbbbbbbbbbbbbbbbbbbbbbbbbbbbbbbbbbbbbbbbbbbbbb",
              "evidence_revision": 7,
              "requested_controls": {
                "model": "fixture-1(api)",
                "effort": "medium"
              },
              "evidence_controls": {
                "model": "fixture-1(api)",
                "effort": "medium"
              },
              "advertised_models": [
                "fixture-1(api)"
              ],
              "advertised_efforts": [
                "none",
                "medium"
              ],
              "task_evidence": [
                "complex graphics rendering"
              ],
              "measured_latency_ms": null,
              "measured_cost_microunits": null
            }
          }
        }
      },
      "candidates": [
        {
          "id": "c_bbdb5e",
          "kind": "execution_profile",
          "description": "Recommend the execution profile described by profiles.c_bbdb5e. Choose it only if executable, authenticated, requested controls supported, capability evidence bound to the current launch, revision at least the policy floor, and the user pin permits it. Use task evidence rather than declared labels to judge fitness; do not infer missing latency or cost. Prefer the configured default when eligible profiles are otherwise equivalent. This only advises the operator; it starts no agent and grants no permission.",
          "host_effect": "advisory_only",
          "escalation": false
        },
        {
          "id": "c_8170d3",
          "kind": "operator_review",
          "description": "Request operator review if no eligible profile fits, a pinned choice is unavailable, necessary task evidence is missing, or the objective requires a multi-task plan beyond a single prepared profile recommendation. No agent is started and no permissions are granted.",
          "host_effect": "operator_review",
          "escalation": true
        },
        {
          "id": "c_d18ff8",
          "kind": "execution_profile",
          "description": "Recommend the execution profile described by profiles.c_d18ff8. Choose it only if executable, authenticated, requested controls supported, capability evidence bound to the current launch, revision at least the policy floor, and the user pin permits it. Use task evidence rather than declared labels to judge fitness; do not infer missing latency or cost. Prefer the configured default when eligible profiles are otherwise equivalent. This only advises the operator; it starts no agent and grants no permission.",
          "host_effect": "advisory_only",
          "escalation": false
        }
      ],
      "expected": {
        "acceptable_routes": [
          "c_d18ff8"
        ],
        "must_escalate": false,
        "fallback_reasons": [
          "low_confidence",
          "no_candidate_fit",
          "unsupported_capability"
        ],
        "risk_confidence_profile": {
          "risk_band": "medium",
          "confidence_band": "high",
          "low_confidence_action": "escalate"
        },
        "semantic_only_authorization": {
          "decision_is_advisory": true,
          "may_activate_trusted_session": false,
          "may_grant_permission": false,
          "host_must_recheck_scope": true
        }
      }
    },
    {
      "id": "python_backend",
      "split": "development",
      "input": {
        "objective": "Choose a profile for a small Python HTTP backend. Frontend work is a separate later task.",
        "state": {
          "schema": "urdia-profile-evaluation-state-v1",
          "synthetic_fixture": true,
          "policy": {
            "revision_floor": 7,
            "pinned_profile": null,
            "default_profile": null,
            "automatic_execution": false
          },
          "profiles": {
            "c_cbfd75": {
              "declared_model": "Fixture profile A",
              "executable_available": true,
              "authentication_confirmed": true,
              "launch_digest": "aaaaaaaaaaaaaaaaaaaaaaaaaaaaaaaaaaaaaaaaaaaaaaaaaaaaaaaaaaaaaaaa",
              "evidence_launch_digest": "aaaaaaaaaaaaaaaaaaaaaaaaaaaaaaaaaaaaaaaaaaaaaaaaaaaaaaaaaaaaaaaa",
              "evidence_revision": 7,
              "requested_controls": {
                "model": "fixture-0(api)",
                "effort": "medium"
              },
              "evidence_controls": {
                "model": "fixture-0(api)",
                "effort": "medium"
              },
              "advertised_models": [
                "fixture-0(api)"
              ],
              "advertised_efforts": [
                "none",
                "medium"
              ],
              "task_evidence": [
                "small Python HTTP backend"
              ],
              "measured_latency_ms": null,
              "measured_cost_microunits": null
            },
            "c_bc27ef": {
              "declared_model": "Fixture profile B",
              "executable_available": true,
              "authentication_confirmed": true,
              "launch_digest": "bbbbbbbbbbbbbbbbbbbbbbbbbbbbbbbbbbbbbbbbbbbbbbbbbbbbbbbbbbbbbbbb",
              "evidence_launch_digest": "bbbbbbbbbbbbbbbbbbbbbbbbbbbbbbbbbbbbbbbbbbbbbbbbbbbbbbbbbbbbbbbb",
              "evidence_revision": 7,
              "requested_controls": {
                "model": "fixture-1(api)",
                "effort": "medium"
              },
              "evidence_controls": {
                "model": "fixture-1(api)",
                "effort": "medium"
              },
              "advertised_models": [
                "fixture-1(api)"
              ],
              "advertised_efforts": [
                "none",
                "medium"
              ],
              "task_evidence": [
                "HTML and CSS frontend"
              ],
              "measured_latency_ms": null,
              "measured_cost_microunits": null
            }
          }
        }
      },
      "candidates": [
        {
          "id": "c_bc27ef",
          "kind": "execution_profile",
          "description": "Recommend the execution profile described by profiles.c_bc27ef. Choose it only if executable, authenticated, requested controls supported, capability evidence bound to the current launch, revision at least the policy floor, and the user pin permits it. Use task evidence rather than declared labels to judge fitness; do not infer missing latency or cost. Prefer the configured default when eligible profiles are otherwise equivalent. This only advises the operator; it starts no agent and grants no permission.",
          "host_effect": "advisory_only",
          "escalation": false
        },
        {
          "id": "c_cbfd75",
          "kind": "execution_profile",
          "description": "Recommend the execution profile described by profiles.c_cbfd75. Choose it only if executable, authenticated, requested controls supported, capability evidence bound to the current launch, revision at least the policy floor, and the user pin permits it. Use task evidence rather than declared labels to judge fitness; do not infer missing latency or cost. Prefer the configured default when eligible profiles are otherwise equivalent. This only advises the operator; it starts no agent and grants no permission.",
          "host_effect": "advisory_only",
          "escalation": false
        },
        {
          "id": "c_7a3ecb",
          "kind": "operator_review",